{
  "_schema_version": "1",
  "_doc": "fixture manifest",
  "generatedAt": "2026-06-14T12:00:00Z",
  "complexityTier": "standard",
  "blastRadius": "low",
  "orchestrationMode": "autonomous-ready",
  "apiPoolBudget": "normal",
  "phases": [
    {
      "phase": 1,
      "stage": "implement",
      "surfaceClass": "headless-loop",
      "surface": "agent-loop-cursor",
      "tool": "cursor",
      "catalogNamespace": "cursor",
      "catalogModelId": "cursor-composer-2-5",
      "roleHint": "implement-default",
      "pool": "composer",
      "variant": "fast",
      "catalogFetchedAt": "2026-06-14T12:00:00Z",
      "basis": "fixture"
    }
  ]
}
